{
  "artifacts": [],
  "command": "report.hsk",
  "data": {
    "counts_by_level": {
      "grammar": {
        "2": {
          "coverage_pct": 0.0,
          "known": 0,
          "total": 1,
          "unknown": 1
        },
        "3": {
          "coverage_pct": 0.0,
          "known": 0,
          "total": 1,
          "unknown": 1
        }
      },
      "vocab": {
        "1": {
          "coverage_pct": 0.5,
          "known": 1,
          "total": 2,
          "unknown": 1
        },
        "2": {
          "coverage_pct": 0.0,
          "known": 0,
          "total": 1,
          "unknown": 1
        },
        "3": {
          "coverage_pct": 0.0,
          "known": 0,
          "total": 2,
          "unknown": 2
        }
      }
    },
    "coverage": {
      "grammar": {
        "coverage_pct": 0.0,
        "known": 0,
        "total": 2,
        "unknown": 2
      },
      "vocab": {
        "coverage_pct": 0.2,
        "known": 1,
        "total": 5,
        "unknown": 4
      }
    },
    "evidence": [
      {
        "item_id": "w_d93362e54c21",
        "level": 1,
        "status": "unknown"
      },
      {
        "item_id": "w_77fdc7f0c56e",
        "level": 2,
        "status": "unknown"
      },
      {
        "item_id": "w_0a5bab8c45c9",
        "level": 3,
        "status": "unknown"
      },
      {
        "item_id": "w_4c8a7694eb1d",
        "level": 3,
        "status": "unknown"
      }
    ],
    "level": "3",
    "window": "30d"
  },
  "limits": {
    "max_bytes": 200000,
    "max_items": 50
  },
  "ok": true,
  "schema_version": "1",
  "truncated": false
}
