{
  "artifacts": [],
  "command": "review.grade",
  "data": {
    "grade": 4,
    "item": "w_0fafdf1e6a67",
    "next_due": "2025-01-02T03:04:05+00:00",
    "recall_grade": 4,
    "recall_next_due": "2025-01-02T03:04:05+00:00",
    "recall_rule_applied": null,
    "rule_applied": null
  },
  "limits": {},
  "ok": true,
  "schema_version": "1",
  "truncated": false
}
